Date, Experience, Questions
2015-09-22 14:31:06.31,i apply it by university recruiting  on feb. and pass an on campus interview. they ask me to talk about my past projects. in the onsite interview  tech questions include reverse liked list  inorder traverse of a tree without recursive  remove duplicate in array  and sort algorothm,inorder traverse of a tree without.recursive   answer question
2015-09-29 14:56:30.053,applied online for a few positions. didn t hear back for 3 weeks  then received an email from recruiter telling that there will be a hiring event and i should apply for another position for a cloud team  the position wasn t exactly for my profile to be frank  and register for event. i did that  and received a link for online tech screen. recruiter was supposed to have a chat with me before that  but he never called on the scheduled time  and didn t even bother to follow up. so i took the test without instructions  it was pretty easy one  i was able to finish in half time. then i sent email to recruiter asking if he can follow up and he said that his calendar was broken  that s weird  microsoft can t provide reliable calendars  was it outlook calendar . then i received the automated reply saying that i didn t pass the tech screen which is just weird. it s the last time i m dealing with microsoft. better spend more time and prepare for google  at least they are professional and organized and treat candidates with respect.,1  implement atoi 2  correct bug in the code that deletes head from linked list 3  given string of digits like  72388  and int n  delete n characters from the sting such the resulting string contains minimal number representation  you must preserve relative position of digits. example  if st  72388  and n 2  the answer is 238.   2 answers
2015-10-16 10:14:17.933,i send my resume to microsoft on school career fair  and received email 3 weeks later. and the interview was held on campus. i was first asked one behaviour question then a question about binary tree. i spent some time finding the idea to solve the problem and then asked to write code on a blank sheet.,first question is  what is the biggest technical challenge you have met in your internship projects  second question is  given a node of a binary tree  find the next node of the in order traversal of the tree.   1 answer
2015-10-22 01:02:00.283,gave resume to recruiters on campus and after 2weeks heard back from them and they scheduled on campus university  interview. after that i went to redmond and had four on site interviews in one day.,string question of removing duplicates from string  and couple of tree questions   answer question
2015-10-18 12:13:52.457,i went for an initial screening interview on campus. the interviewer was very nice and enthusiastic and made me feel at ease. i was asked to write my code on a piece of paper because there were no whiteboards in the room. questions were average difficulty. very enjoyable process largely thanks to the enthusiasm of the interviewer.,you have a traffic detector that logs a timestamp whenever a car passes by. write a function to process this array in various ways  don t remember the specifics .   answer question
2015-09-28 22:04:17.187,on campus    after two weeks  phone interview   told me to wait one or two weeks to get the response. still waiting....,how do you teamwork with other people   answer question
2015-10-15 09:49:10.417,one screening call  then flew out to redmond for on site. the interview day comprised of 4 interviews in the afternoon after a large group lunch. was asked a number of questions about code optimization  array manipulation  some sql stuff  and then design patterns.,why are interfaces important    answer question
2015-10-15 22:17:38.053,i received an email to interview with microsoft on our college campus. the woman was very friendly and began with some general questions about my technical background. we then discussed a technical question and then ended with any questions that i may have for her.,how do you reverse a linked list    answer question
2015-09-25 23:51:18.74,i had an interview on campus in fall 2014 for an internship  but they emailed me back and told me that while the interview went well  they didn t have any positions available at the time. i thought it was just a really nice way of saying  thanks  but no thanks.  fast forward to fall 2015  when my recruiter emailed me and asked me if i would like to go to redmond for interviews since the on campus interview went well last year. i went  and i must say that i was very impressed with microsoft. they drove us potential university recruits to their campus in a limo  the interview process was four 45 minute interviews in a row  with a 15 minute break between each one. i was surprised that i was being interviewed for a group that did higher level programming even though i have studied more low level programming in recent years because i m a computer engineering student. i think some of the other interviewees who were looking for higher level jobs were confused too  because they interviewed most of them for the operating systems track. i m not sure if there was a mix up or not  the interviews themselves were very engaging and the interviewers presented challenging questions. i strongly suspect that one of the people who was interviewing me was texting while i had my back turned and was talking through a problem on the whiteboard  but the rest of it went pretty well. i didn t get an offer  but i m glad i went.,what would keep you from coming to microsoft    answer question
2015-10-07 17:26:35.677,the onsite interview is a really good experience. i learned a lot through the interview process. not hard. people there are really nice and friendly. they are really ready to help you and make you very comfortable.,sorting   answer question
Date, Experience, Questions
2015-10-05 20:40:52.19,referral school career fair  then phone screen  then an onsite. you re either applying for a software engineering role or a program manager  pm  pretty much product managing  role  though often times they don t really take your preferences into account. the onsite consists of 3   5 interviews  it oddly varied depending on the person  not sure why that is .,a recruiter read off a list of questions from a sheet of paper and recorded them down. questions were things like    tell me a time when you worked on a team  what role did you play   tell me a time when you faced a technical difficulty   how many lines of code was your biggest project   tell me about a project you  039 ve worked on   do you like problem solving    1 answer
2015-10-09 12:22:21.383,the guy that i interviewed with was very passionate about working for microsoft and we went over a few technical questions for about 30 minutes before talking about what it is like to work at microsoft,build a class for a vending machine.   answer question
2015-10-15 12:44:42.7,i applied on my university s career fair  and got a interview about 2 weeks later. i was asked about one technique question and my resume  mainly resume. the technique question was shown below  i did it in a wrong way though. the interview last about 30 minutes. overall  it was a good experience.,how to find a cycle in a link list    answer question
2015-10-19 09:48:55.383,it is an on campus interview. the coding problem is merge two sorted array. it is very easy  but i think my performance is not good enough. there re something might be improved  1. use more clear and brief language to express your solution. 2. code faster than you can solve more questions. 3. once you start coding  that is your final solution  so try to do and explain all optimization before that.,1. talk about a recent project 2. merge two sorted array   answer question
2015-08-15 20:46:05.603,applied through my university career fair. it was a phone interview for an internship. most of the questions were related to algorithms and data structures. if you are good at data structures  you can ace the interview.,don  039 t remember much. one of them was the difference between an arraylist and linked list.   answer question
2015-09-18 12:01:37.433,after an on campus screening interview  i was invited to seattle for final round interviews. i had 4 technical interviews back to back mainly centered on coding problems and technical discussions. all of the interviewers where really kind. showing how you approach different problems is key.,standard programming questions involving data structures and algorithms.   answer question
2015-10-08 12:22:01.547,they came to my university and asked me a few personal and technical questions. i received an email asking if i would like to interview and went the next week. i think they did this to all cs majors who had been to microsoft events on campus in the past. i messed up the technical part of the interview but it wasn t too hard. they let you choose the language to do it in. i d recommend python because of all the built in functions.,they gave me a string and asked me how to remove all instances of a certain letter from the string.   answer question
2015-10-07 15:04:34.583,four interviews  ms really a nice company  good impression  the interviews are nice and really want to share their ideas and discuss with you about the problems. just one of them when i explain my code  he played phone.,1. leetcode s spiral matrix 2. wirte a readwrite class and implements readlock readunlock writelock and writeunlock four functions with a mutex class  based on crew pram 3. some string operation algorithm questions   1 answer
2015-10-05 12:47:18.16,on campus interview. first some discuss about my background and then went straight to the white board coding part. it was not very difficult but he asked me for other way to solve it after i gave one solution. then went back to question about how you solve a conflict before.,bst in order output   answer question
2015-09-28 08:26:12.483,it was a pretty relaxing interview. it wasn t like normal interviews where i m barraged with questions  this was more like a conversation. i had two interviewers back to back. they both asked me white board questions and helped me solve the problems.,create a function that will create a score for a word  kinda like words with friends .   1 answer
Date, Experience, Questions
2015-09-30 19:51:48.9,on ground interview at uva. first  he ask me a technique question. it is a very basic problem. but i am very nervous so i do not do well in this problem and make some mistakes. then it is behavior questions. they are very normal   popular behavior questions listed below. the whole interview lasts for about half an hour. at last the recruiter staff let me ask for a question.,reverse linked list. the most impressive project experience. the difficulty in group collaboration.   answer question
2015-10-18 16:22:03.76,there was an on campus interview at my college. i was asked about my interest in computer science. he then proceeded to ask me about caching basics. i was then given a database cache question. for the final round  there were four 45 minute interviews with questions on stacks  depth first search and testing and validation.,implement a stack using arrays.   answer question
2015-10-12 17:09:37.46,it s a 30min interview. i talked about my projects with the interviewer. and he asked me some coding questions  including basics about c  . the interviewer  a indian man  is a senior software engineer who works on operating system. although the question is easy  i still made a small bug in the coding.,q1  given a string s  if there are two adjacent  a   turn the substring into  a   if there is one  b   turn the  b  into  bb . for example   aabbaaa    abbbbaa   q2  how the stl vector works.  i use c      answer question
2015-09-01 16:05:44.363,initial screening interview and then day long interview. on the day  4 interviews. 3  super technical  one is generic. interviewers are super nice  always helpful. they will help you if you are stuck. overall  fantastic experience.,stack related question   answer question
2015-08-19 13:52:44.813,talk about my resume. ask about my previous project  what is my contribution of that project  what is my role in the past job  and some detail background knowledge related to that position  some programming problems,what is your most favorite project in that past   answer question
2015-07-25 10:03:23.337,i was contacted by a microsoft recruiter  who by the way gave me one of the worst customer experiences. the response time for each email was minimum of 3 days    who found a team for me to interview. i did not know that there was a microsoft policy  and i was educated of this via my recruiter   that microsoft does not schedule an interview more than 14 days in advance. so 14 days before i actually wanted to schedule an interview i contacted the recruiter. after being assured that my interview was scheduled  i applied for brief break from work. the interview did not happen when i had taken a leave of absense  so time off wasted  . i feel getting a good recruiter to work with is an important thing with microsoft. there was a 45 min phone screen. there were 5 onsite interviews. 4 techincal and 1 hiring manager. i did not get an offer because the hiring manager said i had a lot of ui experience and the team had another candidate who had more backend experience. the hiring manager requested the recruiter to help me find another position but i did not pursue as the recruiter was a pain to work with.,graph coloring   answer question there is a pixel map with 1  039 s representing land and 0 representing water. find the number of continents  not connected groups of 1  039 s .   answer question convert integers to roman numerals   1 answer write a function to return a list of files  recursively  given the root directory node. how will you design a many to many relational database   what are the considerations you have when creating a web service  how would you do load balancing    answer question
2015-07-05 12:53:46.307,3 interviewers interview you separately  pretty much a basic software interview  ask you a technical question  then make you code it out on their whiteboards. make sure to brush up on your syntax for all the languages you know.,linked list question   answer question
2015-06-29 23:26:25.17,i applied online and got a phone interview about a week later. they started by briefly going over my resume and then delved into a few basic behavioral questions. this part was fine but i stumbled quite a bit when i started getting asked more technical questions. i m not too surprised that i didn t make it any further in the process.,describe the most difficult programming project you ever undertook and the process by which you succeeded.   answer question
2015-06-20 08:39:36.157,i started with an on campus interview that was originally rescheduled. after what i thought was a mediocre first round interview  i was told i would not move on due to no more availability for final round  which was later reversed. despite putting certain offices and positions as my preference on the application  i was interviewed for a team i was not particularly interested in at an office i did not want to be at  it was not clear that the interview would be for a particular team until i walked in the door that morning . there were four 45 minute whiteboarding interviews focused on both coding and design principles.,reverse words of a string.   1 answer
2015-06-19 19:33:02.06,the day consisted of four 45 minute interviews with team members and the manager of the team that was considering hiring me. there was 15 minutes between each interview where the interviewer from the last interview talked with the interviewer for the next interview so each interviewer knows what you have said and done through the entire day.,pretty standard software questions with a pretty decent focus on testing the code you write.   answer question
Date, Experience, Questions
2015-06-11 16:43:57.39,i was approached by the campus recruiter. they came to my school and i did on campus interview. a few weeks later  i was invited to onsite. i met with  5 engineers   engineering managers. all of them asked technical questions or simple behavioral questions  how would you resolve situation where xxxxxxx happens.... ,1. reverse string except spaces. a string has mix of alphabets and spaces. your task is to reverse the string  but preserve the positions of spaces. for example  reverse of   a if  is   f ia  2. an array of size n has all but one numbers between 1 and n 1. find the missing one.   4 answers
2015-05-23 07:36:24.56,got the interview at their campus recruitment event. a plesant microsoft employee who is an alum of my school talked to me a bit about my interests  experiences and signed me up for an interview 2 weeks from the date.,given two rectangles  check if they intersect  he also asked me if i have seen the question before to which i replied i had but that i had not tried solving it.   3 answers
2014-10-15 08:19:23.14,i initially had a on campus interview at my university. it was short 30 minute interview where they went over my resume and had a quick technical question. i heard back around 3 weeks later  mainly b c i had a offer that was on the verge of expiring. they flew me out to the redmond campus that same week. the day of the interview  i arrived on site around 8am and had a quick chat with hr. they told me which team i was interviewing for and sent me to the building for the interviews. i had 5 interviews and 1 lunch interview. this lasted until around 3pm. i received a call the next day and was extended an offer. the technical questions asked  on campus interview  remove duplicates from an unsorted array on site interviews  implement strtok reverse string ie. hello world    world hello  find lca for bst find first non repeating character in string given a list of characters and the function tolower  implement toupper check for palindrome in string and singly linked list check if binary tree is bst,implement strtok   4 answers
2015-05-17 21:12:24.25,5 rounds of interviews.each interview with one interviewer and one hour.from 9 00 to around 2 20. 3rd interview is lunch interview.first interview the question is more difficult than i thought.so we need a clear mind before interacting with the interviewer.lunch interview the first 30 mins is lunch and basic questions about experience and interest.this is a good time to show how interested you are in the team.every round of interview is about 2 algorithm questions and lunch interview has one question.basically they can ask anything.you need to explain how you approach this question and your solution before you start programming.,multiply 2 numbers without using   sign   3 answers
2015-05-30 14:23:22.787,the process was on the phone first  then in person 3 times. the interviewer decided that we should cycle through the teams that are hiring to see if i d be a good fit for any of them. each team was unique enough to offer different questions into difference technologies.,there were more abstract estimations than i expected. the whole how many windows in nyc type questions were rampant  almost to a point where i was questioning the interviewer.   answer question
2015-06-03 10:45:27.813,there was a initial phone interview and then there is an on site interview. the on site interview was in 3 parts each increasing in difficulty. 1.  basic introduction and a simple problem 2.  question related to the group s work 3.  a design question.,1.  find a first repeating string in a large text file. 2.  check if the given cordinates on a map correspond to the correct address  where address or cordinates are provided in a tab separated file  3.  design a game like angry birds   answer question
2015-07-21 13:17:53.817,i was contacted by hr on linkedin. though i was not very much interested  i decided to give a shot. i had first phone interview  and followed by 5 interviews on campus.,1  how would you sort large files. on campus questions 1  2 sum problem 2  loop in list  and detect start of it 3  design tic tac toe 4  hr type interview.   answer question
2015-10-13 18:28:45.17,applied online and communicated with recruiter to schedule a phone interview. basic questions about prior experience and informing me of the job description and requirements. phone interview lasted 30 minutes  later got call for in person interview. did one hour in person interview,what was a recent challenge you faced    answer question
2015-05-06 09:25:32.373,first interview was in university  they asked a matrix question from the  cracking the programming interview  book. afterwards they flew me to redmond for the final round. they literally paid for everything  hotel  flight  rental car  taxi  space needle ticket  meals and so on. during the day i had 5 interviews back to back. the questions are very standard but covers almost all data structures and algorithms. still they are much easier than the ones i got from google. overall the interviewers are very nice and helpful. they made the interviews seem like a work place discussion rather than tests so i was very relaxed and confidently talked my way through it. got an offer within a week.,questions can mostly be found on geeksforgeeks  the topics include binarytree  recursion  2d array  suffix trie  hashing etc. 1. implement  atoi  2. the skylines problem 3. two lines on a 2d dimension  given their end points  check if they intersect  this is more of a math problem but i just coded it up in c    4. binary tree modification  make all parents  values be the sum of their direct children. there are more but i can t remember.   answer question
2015-05-06 15:35:05.02,i had an on campus interview briefly after my school s career fair  then i was flown to seattle for an on site. the on campus interviewer didn t know what haskell was  which really surprised me. other than that it was a pretty easy technical question  and a few behavioral question. the on site interview in their headquarter was very organized  however my last interviewer told me  i know people can t think when interviewers stare at them  so i am gonna check my emails for a while while you code on the board  no need to talk through every line of code to me.  which i found odd. and that was the interview i failed. the questions were all pretty standard  harder than the on campus one but still very manageable.,replace each space with   20  in a string   1 answer
Date, Experience, Questions
2015-03-26 13:59:22.21,sent in resume  got a phone call that was very high level and just asking things like am i allowed to work in us  etc. then i was sent info to set up a technical lync interview with the project lead. this was enjoyable and fairly relaxed. you type code in whatever language you want. i think they like to see your thought process and they will help you if you talk through it and ask questions.,reverse a linked list. implement and evaluate expected runtime of bogosort.   answer question
2015-04-24 08:04:36.22,there were two stages  rounds 1 and 2. the first round is done on the university campus  where they get to know you and assess your skills. i applied after a coding competition held on campus. this interview involved one technical question and some questions about my history. the interviewer simply wanted me to gush about who i am and what i m proud of. round 2 was a very different experience. this round they bring you to the redmond campus for a set of interviews  i was flown out from ottawa. there will be 3 5 interviews  depending on constraints. the interviewers all ask at least 1 technical question  and generally these questions cover your entire skillset. it s difficult if you re nervous  but if you go in with a good mood and no expectations you can get through fine.,design a function that takes in 2 strings representing numbers and adds them together as if they are numbers  and outputs the result as a string. you cannot assume the number is any containable size  i.e. the value represented could be larger than long long long long etc. .   1 answer reverse a linked list   answer question encode decode two strings into one string  and back to two   answer question design a notification system to be used by clients to deliver content to customers.   answer question
2015-03-10 13:43:52.487,one one one interview. interviewer was super friendly. it was more like having a casual conversation with one of the industry s best guys. he told me a lot about the industry culture and life at microsoft. microsoft interviews can be a great learning experience and can motivate you further.,stuff about my resume.   answer question
2015-03-05 16:22:44.28,there was career fair in the school and i was attending there. in ms booth  i found the appropriate position and drop my resume. several days later  i got the email to assign the phone screening interview. i got several questions about oop concept and sort algorithms. and then i got the email from ms and they said they want to invite me for the on site interview in seattle. there are 3 interviewer for on site interview.,1st interviewer asked about the data structure question like linked list and queue and binary tree. and he request to code queue and circular queue. and 2nd interviewer ask me least recently used  lru  cache questions. and i did not know about it so he explained me how it works and he ask coding. 3rd interviewer asked me about the function pointer in c c   and how java language can work like function pointer in c c  . does java capable to pass the parameter using  call by reference  or  call by value   how java can pass the address of object    answer question
