Date, Experience, Questions
2014-08-17 12:12:03.45,round  0 onlinegeneral aptitude  c based mcq   20 questions in 15 mins round  0.1 online coding test about 2 questions for 1 hr round  1 written test about 2 questions for 1 hr round  2 technical interview about a question until u answer acoordingly round  3 technical interview about random questions until ur course,find n noded bst in binary tree   answer question
2014-06-28 16:05:14.72,i had a one on one interview with two people from microsoft. the first part was technical  the interviewer asked me to code a function which would reverse the order of words in a string  and then i had to optimize the solution and consider edge cases  etc... the second interviewer asked me about my projects  my studies  etc...,give me a program and what you would do to make it better    answer question
2014-05-29 00:22:15.57,after sending an email to the hr manager i received a screening form with questions about your personality and experience and then 4 programming assignments where 2 of them had to be solved. upon successfully completing the screening i was invited to come to the microsoft campus where i was to spend 5 hours being interviewed by 4 interviewers. 3 of the interviews all had a short talk about myself and i could ask about them  the interviewers were microsoft engineers themselves  and then they had a code problem that they asked me to solve. so each interview had a focus area and for me the areas were  algorithms and data structures  testing  and general software architecture. the last interview was with the manager about how good a fit i was with the company and was more about my personality and how i handled different situations.,a variation on one of the problems that appeared in the screening form.   1 answer
2015-06-02 07:46:00.867,it was a campus selection process for summer internship at microsoft which later was suppossed to be converted into placement offer. there were only three rounds. 1st round   aptitude 2nd round   technical interview 3rd round   hr interview,they asked questions related to what you mentioned as your field of interest in your resume. i mentioned oops and dsa so questions were from these only. here are some of the questions q1. write algorithm for tic tac toe game q2. draw the class diagram  er diagram of a given real life problem.   answer question
Date, Experience, Questions
2015-09-17 07:52:43.293,applied through university s job posting board. received the phone interview first after applying for several weeks. phone interview was a simple background info about my previous experiences as well as my academic background. after that  i was to meet him on campus for a 1 on 1 interview. very rigorous interview  with brutal dynamic programming questions. which you have to write your program on a piece of paper. the interviewer asks you to speak your mind while writing your program so that he knows 1  that i have multitask  2  and what im thinking of doing. at the end  i did not do so well. he actually gave me advise on what i should be focusing and what i did wrong. he even asked if this is my first big company interview. lol.. yes it was.,coin change dynamic programming problem   answer question
2015-10-13 12:54:49.29,direct on site 5 rounds. questions mostly involved data structures and algorithms. a good knowledge of system design and os can be useful. also revise previous work experience. if campus hire  academic projects. also look at the products microsoft actually deals with.,mostly algorithms and data structures  a little bit of os since my previous company dealt with os related stuff.   answer question
2014-04-22 03:45:19.173,i applied the software engineer position online  and get the on campus interview after few days. interview had two parts  the general and the technical parts. the general part is about the questions like why did you choose to be a software engineer and why did you choose ms. and the past projects jobs you have done   what did you learn from that. the technical part is quite easy  which is just a simple coding question.,find the number of  0  bits in an integer.   1 answer
2014-07-16 07:03:57.71,applied online and passed a online coding test  just questions normal coding interview questions. then a online personality test which called sla. after that i got a onsite interview on microsoft shanghai campus. there are 3 technical interviews. the last two interviewer are very nice  while the first interviewer is anxious and arrogant. i did badly at the first  but did well for the next two.,there are 3 onsite technical interviews. all of them start with a 5 minutes self introduction and most favorite project as warm up. technical questions for each round  1. how to detect whether two given linked list have common parts  2.anagram and extended to deal with large scale case  3. search for words in a random character matrix like a gluttonous snake game  given a dictionary of legal words for match  and required to analysis the time complexity.   answer question
2015-06-25 05:30:22.063,i submitted my resume on web. i wrote about my programming experience and my projects to the resume. the resume need to be written the reason about application to the intern and the diagram related to one of my projects. after 2week i got a guidance of aptitude test. then  i got a guidance about interview.,why did you choose microsoft  why should we choose you  what was the most difficult problem in your experience  how about this interview using english    answer question
2014-02-27 23:56:21.22,first phone interview. interviewer was sick  so he did ask too many questions. sometimes i experienced long pauses.,phone interview  what is the best tech product in your mind.   answer question
2014-03-10 20:51:08.47,the guy who called me wasn t a developer  someone from hr. he was asking questions about my past experience  previous job related questions  one puzzle and other questions about most used programming languages  my favorite software  what i would like to improve. the puzzle was about nine pieces of marble. they re all equal  except one which is heavier than others. you have balanced weights and you have to find the heaviest one by weighting only twice. i d encountered this problem before and solved it  so during the interview  i guess i solved too quickly.,the guy was quite likeable and friendly  but it was strange for me that he didn t want to know any particular technical details regarding my experience  so i actually didn t know what to tell him then.   answer question
2013-12-19 14:09:58.457,interview before current techniques implemented so not really applicable  still was asked problem solving skills rather than specific coding skills. also ms look for people who want to work for right reasons not money.,different ways or sorting  going through an algorithm for combining and sorting 3 list of data.   answer question
2014-10-22 11:53:11.51,i was found by an interviewer at an university fair where we had a short talk. the next day i attended an open presentation by microsoft where they went in depth about one of their technologies. i asked a lot of questions trying to clarify missing bits and pieces. after the presentation i was invited to an interview the next day. it was a simple one question  45min filter interview to determine if i was ready for the real thing. later they flew me to another interview event where i had 4 consecutive interviews that lasted a total of 5 hours. i was mostly asked system design questions and was expected to discuss this with the interviewer. there were 1 2 simple programming questions to see the way i think.,output the elements of a binary tree in zig zag order   answer question
2014-09-12 09:46:18.767,it was a recruiting event on campus. then an interview in microsoft offices  mexico city. then 3 rounds interviews were held on puerto vallarta. all microsoft recruiting staff are very nice people.,there were not unexpected questions  the hardest part is to control your nerviousism.   answer question
Date, Experience, Questions
2013-11-24 22:17:38.74,i handed my resume to the people at the microsoft stand at my university s career fair and got an email a few weeks after asking me to come to the initial screening. i got to talk to one person about myself for half an hour  including my approach towards software engineering and why encapsulation is important etc. the next half hour was spent solving a simple c problem and talking about the differences between java and c  . a few days later i was invited for a full interview in a month. it was a four hour marathon session with four software developers.,this one took me by surprise  write a function in c that will verify if an ipv4 address is correct or not.   1 answer
2013-11-20 17:07:09.69,applied through university  had an on campus interview. fairly standard interview questions  why microsoft  couple of string coding questions find all substrings of a given length  count occurrence of letters in a string . on the whole it was fairly straightforward  the recruiter is also interested to know what team you would like to join and why.,find all substrings of a given length in a string   answer question
2013-11-13 21:41:54.703,submitted the resume in job fair. one week later got email for an on campus interview. two parts for the 30 minutes interview. first part  asked some questions about my previous experience. second part  3 questions   1  compare two integers a and b without      and without if statement   2  what s deep copy and shallow copy   3  how to test an atm machine  result  got an on site interview.,compare two integers a and b without      and without if statement   2 answers
2013-11-14 00:31:05.197,four interview in hong kong,insert a new interval into a sorted intervals   answer question
2013-11-03 13:25:05.38,it was just the first interview and i do not have the result yet. i have applied for it because there were interviews on the university. firstly i was asked to say something about me  then was the algoritmic question. i was asked only one question connected with algorithms or computer science.,you are given two linked  one direction  lists  as poiters  they meet somewhere and have common ending. count nodes.   answer question
2013-11-04 13:19:17.747,recruiters came to campus and held a programming contest. attended the competition and submitted my resume. got a 30 minute campus interview one week after resume submission. didn t hear back from the recruiter one week after the interview while many of my friends did. sent an email asking for feedbacks and got the rejection email after another week.,only one question  delete the duplicate files in a file system  have to resolve much ambiguity .   answer question
2014-07-04 09:01:51.66,they went to our campus and asked us to write some code to reverse a string  then i had to go to a 1 1 interview at their office  after that i received an email telling me that i had to fly over to puerto vallarta to be interviewed  it was cool.,how do you test a function that receives two paths of files  strings  and copies the file specified in the first one to the second path.   1 answer
2013-11-15 16:44:43.547,i applied through their graduate recruiting website and got an email the next day inviting me for an interview. i was called punctually at the time i chose. the interview started with a very slow pace  but we had to hurry up after some time because there were to many questions to be asked.,you have 9 marbles. they all have the the same weight except one of them  which weighs slightly more than the others. you are given a balance scale. by using the scale only two times  detect the heavier marble.   1 answer
2014-02-07 13:38:11.557,there was only one phone interview. some questions on it were about testing toaster  task about finding certain ball from 12 balls and so on. also there was 3 onsite interviews in a ten days after phone interview. i was asked to solve three tasks  write merge sort  string problem and number notation. there was no behavioral questions.,unexpected question was about number system. i did not fully understand one  may be moslty because my poor english   so interviewer had to change problem.   answer question
2015-04-17 13:58:29.107,a screening interview first then the on site interview with 3 developers. interviewers were not really helpful and i couldn t understand their real questions. it would be nice if they have given some food since i was there for 5 hours and eventually i got hungry. it would also be nice if they have given the feedback from the interviewers.,given 2 nodes in a n ary tree find the common ancestors.   answer question write a function which takes two rectangles  as coordinates of top left and bottom right  and returns the intersection of them  again as coordinates .   answer question how would you read data from a huge file    answer question
Date, Experience, Questions
2013-11-09 21:14:34.947,phone interview with the following questions    who is your favourite programmer and why   an example of solving a complex problem and in general  the steps you follow to do so   why do i want to work with  whatever layer you chose on your application    how would you test the suitability of a keyboard for kids in elementary school    difference between a thread and a process   difference between java   c  ,  given 9 jars filled with marbles  8 of the jars have marbles that weigh 1 gram and one of them has marbles with 1.1 gm    find the one with the 1.1 gm marbles. you have a digital scale and can only use it once.   answer question
2013-12-17 12:06:17.297,on campus interview  technical questions  not very friendly,simple linked list question i wasn t prepared to deal with  it had been a while since i practiced my coding  and i had midterms so i didn t have time . elements of a linked list can have a  dirty  boolean tag  implement void setdirty node  and boolean hasdirtydescendants node    1 answer
2014-11-18 11:57:48.34,sent resume in campus career fair  got contacted by hr 6 months later for a full time position. a phone interview followed by on site interview in headquarter. on site interview consists 4 rounds  four 1 1 interview with microsoft engineers.,most difficult questions are server related as i don t know much about it.   answer question
2015-09-30 21:19:43.777,the interview process consisted of two technical rounds and one hr round. in the 1st technical round i was asked two coding questions and a puzzle. the programming questions were doable if one had solved some questions on sites like career cup and geeksforgeeks. in the second interview too there were two coding questions  puzzles and behavioral questions.,1. why would you like to join microsoft  2. which product of microsoft do you like the most and why    answer question
2013-09-06 11:14:39.443,the process from sending the cv to the first interview took  1 month. hrs had not responded for a long time. then they arranged a phone interview with a senior developer from ms. the interview was quite brief. he asked a couple of general questions like  what is your software development background    what are you working on now  . then we came directly to programming. there was only one problem  determine whether two strings are anagrams  i.e. contain the same letters.,anagram detection. this algorithm s complexity can be reduced to o n  by counting frequencies of every letter from two words and comparing them. i didn t come to that   instead i suggested a o n log n  algorithm. it seems that was my fault.   answer question
2013-09-03 13:17:36.923,i attended an university recruiting. first a phone interview then on campus interview in four stages. phone interview was behavioral  but you get to be asked to provide some hacks mostly on tricky algorithmic questions at on campus meetings. i did get through all the steps but couldn t get the job offer. as to my understanding you have to give  or at least on the way  decent answers in all of your interviews  even one recruiter hesitates then they look for someone else.,questions are not always hard by itself but most of the time what they look is how you approach to the problem and in what way you could improve the code.   answer question
2013-10-15 11:31:37.567,there is only one question  find the common ending sub string from a list of strings,no unexpected question   answer question
2014-05-24 02:10:01.573,i had one phone interview over skype with recruiter where i was asked about my past projects and experience. i was also asked to solve little puzzle question. it felt strange and non relevant to my job application. i expected another round of skype interview  but instead i was invited for an onsite interview. i had 4 technical interviews onsite  all of them  45min. all had similar process  you meet the interviewer  he talks about himself and his job role. then you talk about yourself. at the end you get a coding problem that you have to write on the whiteboard. most of the questions are from cracking the coding interview book.,i got a question about how can you know how many ones  1  are in the huge bitmask  10 7 bits  using processor s machine language. it wasn t expected to have a correct answer though.   1 answer
2014-12-09 14:17:49.143,they came to my university  asked few questions  gave us problems to solve in few time and only some of us got the interview. in the interview  45 min   they asked me questions about me and what i can do for the company  gave me 3 problems of sorting  strings and trees that i solved easily   it looked like all was fine but i wasn t accepted   ,preorder tree traversal  knowing if a string is a palyndrome and sorting   answer question
2014-01-21 20:46:17.22,it s a long process and you need to prepare a lot. i was an intern so i attend the convertion program. and there are four rounds interviews in the convertion program.,interview will ask any computer science questions  deeper and deeper   answer question
Date, Experience, Questions
2013-08-09 22:49:51.243,i applied through the microsoft career website. an interviewer called me in a specific time  then i passed the phone call stage. in the phone call  you are talking about past experiences  some riddles and testing and design details. after that  they called me for on site interview. because of the company rules  i cannot talk about the details of the on site review  however  you can find sample questions in the leetcode and other algorithm websites.,look at the leetcode or another algorithm website... microsoft likes to ask data structures related algorithm questions...   answer question
2014-04-29 03:54:30.153,2 rounds of written test followed by 4 rounds of 1 hour interview. 3 interviews were 1 1 and 1 was a group interview.,every question is unexpected. they dont ask you stuff out of a text book.   answer question
2014-08-24 09:52:52.653,consisted of 15 mcqs mostly related to c c   and probability. it was fairly easy and very few people were eliminated round 2 online  1 hour   round 3 group fly round  30 minutes    round 4 f2f  90 minutes   round 5 f2f  ,given an array of integers where all the elements occur odd number of times except 3 elements which occur even number of times  find the 3 elements.   1 answer
2013-07-29 22:43:24.663,two interviews on campus  waterloo . both had technical questions.,program a representation of a stack without using libraries with o 1  and the ability to push  pull and peek.   1 answer
2013-07-21 10:32:27.03,on campus placement. had a written round first. top 15 are chosen for interviews. most problems were on data structures and algorithms. the last round was conducted by a partner level person who decides your role in the company,given a bst  construct a circular doubly linked list at each level   answer question
2013-07-12 05:16:35.55,i was intern at microsoft. went through 4 rounds of technical interview at the end of internship period followed by technical discussion with general manager of my division,out of 25 horses select the fastest three in minimum number of races where in each race there would be exactly five horses.   9 answers
2013-07-17 18:59:21.573,applied online  and wrote about past projects. first  i did online webtest wich includes japanese and simple logic questions. second  i went to the office for technical screening. it took only 30 minutes and i was asked to write a simple code on the whiteboard. third  there was a loop interview then. first three interviewers asked more of technical questions  such as radix sorting  trie structures  simple binary tree without memory leaks. and the fourth interviewer at the loop interview asked more of non technical questions  such as presentation skills.,how do you find pi using statistics. do radix sorting of unsigned integers  then what if integers were signed. delete spaces of null terminated c style string in place.   1 answer
2013-11-23 01:49:51.797,you are constantly being tested on basics. you gotta be logically strong and keep calm. the keep yo success here is to have your basics strong. it would not matter what was your gpa. basic knowledge of any programming language and good problem solving skills is good to go.,did not feel anything was difficult   answer question
2014-01-11 09:07:43.86,submitted resume. initial interview with recruiter consisted of resume review and a couple of brain teasers. interview with engineer consisted of a coding question. final interview day in sydney consisted of 3 interviews with engineers.,n people in a party consisting of celebrities and normal people. all normal people know the celebrities but celebrities don t know anyone but themselves. write code to find the celebrity.   answer question given an integer as input  return the number of 1s in the input s binary form.   answer question
2013-05-16 09:48:23.953,my first interview was a brief phone screening which was just about me and my projects. i was then invited to join an online group meeting on microsoft lync which is similar to skype  during which a member of hr spoke to all candidates. they discussed the next interview process and answered any questions asked by the candidates  there were about 35 candidates . a date and time was allocated by follow up email for each of us to attend the interview in the sydney office. on my interview day  there was a total of 5 interviewers  all senior members of the microsoft team   and 5 interviewees. we each received 3 4  1on1 interviews in separate rooms  rotating between the interviewers. a decision may be made after 3 interviews or you may be given a final 4th interview if needed. i went through a total of 4 interviews  45 minutes each with 15 minute break in between. the breaks were spent with the other candidates and a member of the hr who discussed about microsoft s work and workplace. the interviews generally went like so  first 5 15 minutes    the interviewer introduces themselves and their job.   asks about you  your projects and your past work  basically your resume . next 25 35 minutes    interviewer gives you 1 2 problems  you are to provide your implementation on the white board.   interviewer asks you to give test cases to your implementation. final 5 minutes    any questions you may have for the interviewer. my interview questions  1. write a function to determine if a string is a palindrome 2. a. give a list of expected functionality for the  linked list  data structure b. write a function to reverse a linked list 3. a. write a function to determine if a number is prime. b. write a function to reverse an integer  i.e. 123   321   with o 1  space complexity. c. write a function to round a float to the nearest integer  i.e. 3.14   3  3.56   4 . 4. write a function to print all paths of a binary tree to a certain depth length. example  input  the following binary tree  searching to a depth of 3 5     3 7         1 2 5 8 output  5 3 1 5 3 2 5 7 5 5 7 8,write a function to reverse an integer  i.e. 123   321   with o 1  space complexity.   answer question write a function to print all paths of a binary tree to a certain depth length.   1 answer
Date, Experience, Questions
2013-04-18 22:07:03.25,through the university of waterloo recruitment  jobmine . they e mailed me for a 1st round interview  nothing too out of the blue. basic behavioural questions  one technical coding question  one discussion question about technology and how it can be improved. be sure to ask them questions which makes them think as well.,one programming question  moderate  but for a cs person would be easy  and a question about a favourite piece of technology and how to improve it.   answer question
2013-11-29 10:59:29.58,apply via their website. if you are a match  they forward you a word document with 2 pages of questions about your previous experience and 4 different programming exercises where you are to do two of them. if your response is accepted  you get a phone interview where you do a programming exercise live while discussing with the interviewer. if you make it through this gate  you are brought in for a half day of interviews  in my case 5  with different whiteboard programming exercises and cultural interviews.,design a code merging tool   answer question
2013-06-30 09:39:55.523,1 row of written exam 3 rows of interview,1. warm up question  about preview projects. 2. warm up question  difference between heap and stack. 3. algorithm  given a unordered array  filter the elements that can make up an ascending sub array without changing their order and the sub array should be the longest one. 4. code implement  delete all the blank in a string  string inverse. 5. some questions on testing trick.   answer question
