Date, Experience, Questions
2011-03-29 17:45:18.9,phone interview lasted about 30 minutes. i felt like i underperformed but still got called back. scheduling the real interview was a pain but very flexible. interview was 5 individual interviews with different employees within the group  one being a phone interview. 3 focused on programming challenges  1 on personal motivations experiences etc  and the final was a casual interview where i mostly asked questions. the programming interviews were all on a white board  which was the largest difficulty for me personally.,write a non recursive traversal of a binary search tree using constant space and o n  run time.   3 answers find a duplicate integer in a list of length k with integers 1...k 1 and one duplicate. do so in o n  time with constant space.   3 answers
2015-02-09 23:30:03.993,basically  they came to my university and we had a phone interview. after that  they selected a group to fly up to redmond for the weekend and we had a full day of interviews. each interview is with a different team that you can work with and all operate roughly independently  i.e. if you bomb one  you can still get in with a different team . after that  you wait for each team to decide whether they want you  they typically choose their top few candidates and then get the first one that isnt taken by another group .,one example that i thought was interesting  given a list of points  find the line that goes through the greatest number of them.   2 answers
2015-10-16 14:41:05.187,first  hr had a phone screen with some general questions. then  a senior engineer had a phone screen of technical questions. then  on site with 5 engineers about writing code.,reverse a linked list.   answer question
2012-03-28 12:50:37.287,phone interview. if this goes well  you get schedule for all expense paid trip to seattle for onsite interview. if that goes well  you get an offer.,queue with circular array   answer question
Date, Experience, Questions
2012-07-13 15:44:02.13,2 phone interviews followed by full day interview with 4 different people on microsoft campus.,create a data structure that minimizes time complexity of retrieving median and inserting new element. getting median should be o 1  and insertion should be o log n  .   4 answers
2011-04-05 18:42:19.033,i received an interview after giving them my resume during an on campus visit. they promptly contacted me in a few days saying they were interested. i got an on campus interview with a software development engineer. it was a 30 minute interview in which he asked one programming questions. i had to write the code on the board. it wasn t too difficult and he continued to probe my mind while i wrote code such as  why this method  how would you test this  is this the most efficient . i ended up getting a pretty good solution and was confident i did well. although i was not offered an on site interview. thinking back on what i would do differently  i would ask more clarifying questions  and more clearly explain why my solution is optimal. i get pretty nervous sometimes which causes me to not explain terms as clear as they can be. however it was a good experience and good interview practice.,write code that would shuffle a deck of cards. explain why your solution is optimal and how you would test it.   answer question
2012-09-22 12:26:00.45,had a initial phone screen round which was based on behavioral type of questions. this was followed by 4 rounds of on screen interview. most of the problems asked were algorithmic. you are expected to write working code on white board. all interviews are 45 50 mins long.,pick out k random elements from a very long linked list   2 answers
2011-05-19 23:41:20.34,i ve got a phone interview with a hr. some questions about resume and personality  and one open question to solve a technical problem,how do you find a interviewee s phone number    answer question
2011-03-08 14:22:05.943,submitted resume during university career fair  got email to sign up for 1st round interview few days after the fair. 1st round interviewed at university career center  takes about 30min. brief review my resume  and then two programming question asked. got feedback after about one week to offer fly me to seattle  wa for second round. flew there on sunday  interviewed on monday  and back the next day. got feedback after 4 days saying they aren t gonna extend an offer.,find nearest atm machine given gps location and a list of atms   answer question what data structure would you use to store a dictionary supporting search like  ab p    1 answer reverse a binary tree   answer question stretch a linked list with bottom node   answer question find missing number in a array of size 100 for number range from 0 to 100  no repeat    answer question
2011-01-24 18:08:40.103,took a day. 3 4 interviews with different people. all technical questions.,write a function that turns a string of integer to a string of english words of that integer. bit manipulation. write a sqrt function.   answer question
2011-02-08 18:07:56.247,i didi my first interview in my university and after one month i heared back from ms. i interviewed with 4 people during my on site interview. the process was well organized and i was be able to interview with the team that i m interested in most. the technical questions were not too tough  and everyone asked me about former projects. they supported all the costs during 3 day interview and the feedback was with in one week.,how do you find a target string in a source string    3 answers
2012-08-29 21:42:17.383,a couple of recruiters came to our school last winter looking for a few candidates. had an initial screen that was easy as hell. basically all hr questions. this kind of dodged the phone screens. got called for an on site interview after a month and flew to seattle  wa to interview in their redmond hq. the on site interview consisted of 4 interviews that were 1 hour each. they were technically taxing from start to end. most of the questions  which i don t really remember now  were not seen heard of by me. most involved coding on the whiteboard. i took the algorithm first  code later approach. most topics dealt with data structures  algorithms and some logical thinking  i got to design code the initial moves in checkers .,the last question  given some hardware  design and code a file system  of course  very high level .   answer question
2012-03-14 19:01:04.78,i live in australia. first i applied for sde at microsoft and i waited for almost 1 month to get a telephone interview. 2 month after that i got an email ask me to attend for the interview in singapore. in singapore i had 4 rounds of interview basically about c programing language and algorithm. unfortunately i didn t get any offers but the interviewer encouraged me to try again next year.,using a mac function tolower char c  to write a toupper char c  function  without using any ascii code   3 answers what is the fastest way for a mouse to find the cheese in the maze    1 answer
2011-01-19 17:36:55.497,my first interview was a 30 minute on campus screen  one puzzle question and a few short  general cs questions. if you know anything at all  this is a piece of cake. the remainder of this review describes my on site experience. regarding travel arrangements  i experienced a flight cancellation for my return journey  but the travel team was very supportive and helpful  extending my hotel stay and rebooking my flight. regarding the interviews  most of the advice and information available here and elsewhere online is quite accurate  just note that they generally do not ask  mount fuji  questions anymore   and as there is a lot of it  if you are unable or too lazy to find it you certainly do not deserve an offer from any company  i will only give a brief outline of my experience. i arrived at the recruiting building in my rental car and managed to find a single open parking spot. after checking in at the desk  i had about 15 minutes to hang out in the lobby area with around 12 other candidates. they provide free drinks  xbox  and some weird machines running a program called something like  tell us about yourself   which i tried to use unsuccessfully. the recruiter took me to an office where we spent about 15 minutes going over the day  some interview advice  and a little about my goals and background  nothing technical or difficult. the first 30 minutes of my first  real  interview consisted of discussing his and my background and me asking lots of questions about the product since i had never heard of it. the remaining 30 minutes were filled by a problem on sorting  design  complexity  and pseudocode. he had a somewhat similar background so we had no trouble connecting. next was my lunch interview at a nearby cafeteria. there was a wide selection of reasonably priced food  though i had a voucher for a free lunch . i decided on a salad for ease of eating. we talked about the company  the team and my goals. back in his office  i worked out two problems on trees coded up in c  . the next interview was entirely coding  two of the questions were easy but the third gave me trouble  it was the craziest recursion i ve ever seen. make sure you practice with trees a lot  and don t bother much with general graphs. the interviewer gave me lots of tips  and i finished the code at the last minute. the fourth interview was more like the earlier ones  relatively informal conversation in the first half followed by a technical question  in this case design. i had to design a data structure to represent the state of a game. pretty open ended  i think the idea is just to have a dialog about design tradeoffs  memory vs. speed and so on . finally i was happy to make it to the last interview with an upper level person which involved more discussion of the team and my past experiences no technical questions. be sure to have something to say about every item on your resume difficulties you encountered  what you learned  etc. i briefly met the recruiter again and went back to the hotel. in a few days  i heard the good news from the recruiter. so my advice is  1  ask questions  be curious  and be enthusiastic about the team product and the company. if you are having a  conversation  and not just a dry q a  then you are probably doing this well. 2  spend a few minutes verbalizing your ideas before writing any code. 3  don t code silently. 4  practice coding on paper or a whiteboard before the interview  preferably with someone watching over your shoulder. it really helps  5  try to learn something from each interview  anything  then use it in a later interview  especially if the interviewer specifically gives you advice. they want you to succeed. remember this if you get nervous. this is mostly drawn from advice i ve heard elsewhere  but i found it to be particularly useful. good luck  also  everyone i encountered at microsoft was very nice and personable. the interviews felt mostly relaxed and enjoyable.,data structures and algorithms  with a bit of design and some soft questions about your goals and background.   2 answers
Date, Experience, Questions
2011-02-06 15:49:42.397,asked about how to locate a element in an rotated  sorted array. you ve been given an array that is sorted and then rotated. example let arr    1 2 3 4 5  which is sorted and then rotated say twice to the right to give  4 5 1 2 3  this can be done in o logn  using a slightly modified binary search. the interesting property of a sorted   rotated array is that when you divide it into two halves  atleast one of the two halves will always be sorted. i am not interested in the groups of developing explorers  so i did not proceed.,asked about how to locate a element in an rotated  sorted array. you ve been given an array that is sorted and then rotated. example let arr    1 2 3 4 5  which is sorted and then rotated say twice to the right to give  4 5 1 2 3    1 answer
2011-03-08 12:39:21.757,the whole process was pretty swift  there was the first interview in college after which they offered me an on site interview. were pretty flexible with scheduling the interview and also took care of travel   hotel expenses. the actual interview lasted one day  first i went to the recruiting center where i met my recruiter and talked to him for a while  then i took the shuttle and was off to my first interview. the interviewer asked various questions  some were related to apis  some were related to my earlier experience  and some were general problem solving questions. i had four different interviews that day and that pretty much was it. after that i came back to the recruiter office  talked with my recruiter again and the next day told me their decision.,find the character with longest repitition in the string e.g. aaacccddddeefffffffg the result should be  f .   4 answers
2011-01-11 17:25:01.68,got call for interview via campus fair. had oncampus interview of abt 30 minutes. it was more of background information and passion questions plus 1 technical quest  how do u find substring in a string . had 3 interviews in onsite round. first one asked abt design question which needed hash table then he asked me to code on white board in which i made few mistakes. second interviewer asked to code strstr   function. last interviewer asked to solve the problem   one array has size n and n elements . second array has size n m and m elements. both the arrays are sorted. we need to get n m elements in second array in sorted order. linear time algorithm was expected,design question which needed hash table   answer question write code to implement strstr   function of c   answer question one array has size n and n elements . second array has size n m and m elements. both the arrays are sorted. we need to get n m elements in second array in sorted order. linear time algorithm was expected   1 answer
2011-07-18 20:20:08.45,on campus pre select. after gong through that  was notified for an onsite in seattle. went through 4 interviews with 1 or 2 technical questions.,design and write pseudo code for tcp using udp   answer question
2010-12-21 12:30:20.933,the interview process lasted 8 hours which ended with a 1 1 interview with the hiring manager. i felt overall i did well but no offer was made. know your different types of data storage and how to dumb down your technical knowledge.,find the common parent of any 2 roots in a tree  not a binary tree or any tree where parent have numerical relevance .   answer question
2011-09-08 18:28:09.12,initial screening   some behavioral questions. how many lines of code have you written in your previous job. sorting algorithm in recursive and iterative approach.,how many lines of code have you written in your previous job    answer question
2010-12-26 06:24:23.93,i was contacted by a microsoft college recruiter. i initially applied for a software development engineer intern position but because i was in my last year of my master s degree the interviewer told me that i can t apply for an internship position because after the internship i wouldn t be going back to school anymore. so she decided to interview me anyway but consider me for a fulltime position. i wasn t sure if i want to move from my country to the states so i guess this thing was a major black ball for me  i guess . after all the questions were related to the projects i listed on my resume. she asked what was the most technically challenging project i worked for in the past. i didn t review enough my projects because i didn t have enough time and because mostly of them were os  kernel related and i mostly forgot how i did them and what were the major problems that i had to overcome. so an advice would be to review all the interesting projects that you did in the past in order to answer rapidly and accurately about them. i think this was the major reason that i didn t get an onsite interview  bacause the interviewer couldn t make a clear idea about the projects that i did .,what was the most technically challenging project that you ever did     answer question what is good code     answer question
2013-09-22 15:05:38.43,five half hour to 45 min one on one interviews with whiteboard coding questions of increasing difficulty upon success. one interview may take place during lunch. at the end of the day  you are immediately presented with a hiring decision. interviews mostly ask coding questions  but some are more algorithmic problems  and one is a design question. very much your run of the mill technical interview experience.,implement in c  the most optimum way of finding the closest common ancestor of a binary search tree.   1 answer
2010-11-20 10:22:27.687,i got 3 1 1 interviews and 5 technical questions in total. i thought i did well in the interviews but it turned out that i did not get the offer,write strcmp   answer question
2010-11-30 13:26:03.127,i was first contacted by a recruiter who scheduled me for a phone interview and online skills assessment. the phone interview took 20 minutes and i was called back within a few hours where they informed me that they d like to fly me down to headquarters for a day of interviewing. i was then flown down 3 weeks later where i spent the weekend in redmond  wa on an all expenses paid trip courtesy of microsoft. my day of interviews consisted of 4 1 1 interviews with employees within a specific team. i was then informed about a week later that they d like to extend me an offer which i gladly accepted.,given an array of size n  filled with unique integers between 0 and n  how would you determine which integer was missing from the array. an initially simple question that was made increasingly harder after each correct answer to incorporate such things as memory processor limitations  etc.   answer question
Date, Experience, Questions
2010-12-20 11:23:30.72,how would you convert a string into a number  for eg   123  into 123. very helpful interviewers.,convert string to number.  123  to 123   2 answers
2011-08-17 16:01:20.053,excellent interview. lots of data structure questions. algorithm questions. programming questions. operation systems questions. general questions.,implement a stack using two queues.   8 answers
2013-01-20 18:47:12.9,had a on campus interview first. then  went to on site interview. there were 4 interviewers in total. everything was fine until i met the 3rd interviewer. he threw out the question at me and i thought about an approach first. but  he started yawning and picking his ear which gave me so much pressure and eventually i ended up screwing up the interview.,given two linked lists which may or may not share a node  merge them in sorted.   answer question
2010-12-11 18:55:35.94,interviewed at college  easy interview   onsite interview  3 to 5 interviews ,tell me about your research thesis   answer question
2012-02-29 22:23:17.543,i first had an on campus interview and the question was to decide whether a string is a palindrome. after a few weeks  i received an email from the recruiter saying that i made to the next step  which was the on site interview. the on site interview consists for four rounds  each of which last 45 mins.,what is a singleton    answer question design an elevator system.   answer question what is your favorite device  why do you like it  what can you do to improve it    answer question
2012-04-06 13:23:53.72,i applied at a campus career fair and was invited to an on campus interview with microsoft. the recruiter that scheduled my interview sent me two invitations and three separate confirmations. none of the confirmations were at the same time  and two of them were with different people on top of that. i wrote back to confirm the third confirmation and then showed up at that time only to learn that my interview was scheduled for a different time entirely. the issue was ironed out and my interviewer ended up missing his lunch break to interview me. he asked me a data structure question and had me work out the answer on paper. i worked it out and tried to explain it to him  but he seemed fairly disinterested. he then followed up by asking me how i would test my solution  and then he left. i was pretty frustrated at the scheduling snafu so i probably didn t do as well as i could have. over a week later i was informed that they wouldn t be going forward.,write a function that searches a linked list for a given value.   1 answer
2014-01-31 12:14:43.19,college hire  one interview in college and 5 rounds of interviews onsite.,design discussion with the director of dev   answer question
2011-08-26 13:00:14.617,the interview asked my background and my interest. then he asked me about that ms products i have used. he was majoring in ms one note and he asked me whether i have experiences with one note. then he asked my comments or suggestions on ms products. then comes technical question  to insert a node into a double linked list.,insert a node into a doubly linked list   answer question
2010-10-20 13:42:57.047,i got the interview by sending resume to both microsoft official website and the career center of my college. it gives out lots of interview opportunities  which means it would be very competitive at the same time. i interviewed with a hr recruiter  who is a nice person and asked both behavior questions and questions relevant to test. however  i don t think i answered the behavior questions well.,what is the a ideal programmer or software developer looks like  if the ideal model has grade 10  what will be your grade    answer question what is the most proficient programming language to you    answer question what is your ideal job position    answer question
2010-10-31 23:06:26.953,one campus interview  one hr interview  hire,on excel  you need to return the sequence of number for alphabet. if you got  aa  you need to return 27   1 answer
Date, Experience, Questions
2010-09-07 22:41:47.307,i made a general submission on microsoft s career site. about two months later  a microsoft recruiter contacted me and asked me some general questions about my background. she then directed me to another recruiter who asked me if i would be interested for a position on the msn team. i said i was interested  and a few days later  she set up a phone interview with the hiring manager. the phone interview was completely technical. i had to write code in a live meeting session. first i was asked to write some very basic html and css. then i was asked to code up a problem that was recursive in nature. i struggled a little bit  but was able to come up with a solution in the end. a few days later  my recruiter told me that microsoft wanted to fly me to seattle for an on site interview. a week later  i flew out for a day of interviewing. my interview consisted of three one hour interviews  and one 1.5 hour interview that included lunch. my first interviewer had me code up a pretty standard problem on the whiteboard. as i coded it up  she asked me questions about what i was doing and how efficient my code was. my final code was not very efficient  but that turned out to be okay as she was just looking to see how i think. she also asked me to describe a time where i solved a hard coding problem on my own. my second interviewer had me design the classes that would be required for a css parser that would ultimately try to compress a css file by merging redundant selectors. most of my time was spent designing the basic data structures and explaining how i would go about merging selectors. again  he was just looking to see how i think. my third interview consisted of a one hour lunch followed by a half hour whiteboard coding session. the lunch portion was pretty casual where we mostly talked about what i ve worked on in the past. the coding portion was pretty standard. i struggled a bit  but that turned out to be okay. i was told ahead of time that the fourth interview was contingent on how well the first three interviews went. so i was happy when i was told that i would have a fourth interview. the fourth and final interviewer was an old man who was higher up on the ladder. the interview was very laid back. he asked me questions like why i wanted to work at microsoft  how long i intended to stay  and if i plan to pursue higher education. it was my impression that if you make it to the fourth interview  it s already been decided that you re technically capable of working at microsoft. now it was time to see if you had the right personality to work there. two weeks later  my recruiter called me up with an offer. overall  very positive experience. every interviewer was very nice. they all tried to make me feel as comfortable as possible  giving me helpful hints when i started to struggle with a coding problem. they were definitely more interested in how you think than the final code that ends up on the whiteboard. perfection is not required.,you have a pile of coins. one of them is counterfeit  and its weight is different from the other coins. all of the other coins weigh the same. you are given a balance. how would you find the counterfeit coin  now code it up.   4 answers describe a time where you solved a hard coding problem on your own.   answer question why do you want to work at microsoft    answer question
