Date, Experience, Questions
2015-08-21 11:33:33.49,had a phone interview where they generally screen if i was a better for for sdet  sde  or pm. after a month so i was told that i got to the next round. they flew me out to seattle for a super day. there i had four technical interviews.,there is a pattern in an array  i.e. incrementing by two  fibonacci numbers  increment by just one   but one of the increments in the pattern is wrong. how do you figure between which two numbers the pattern is different  example   1  3  5  6  8  10  12     amp amp amp gt  how dod you figure out that the patter fails between the second and third index in the array.   1 answer
Date, Experience, Questions
2014-02-14 15:18:08.027,submitted my resume at on campus recruit for any projects related to user experience. heard back in 2 weeks for a software developer position. phone interview in the following week.,1 design your own alarm clock. 2  if you re manufacturing a keyboard  how would you make it and what would you change  how would you check the final quality of the product  3  you have three baskets. the first one only has apples  the second only has oranges  and the third one is mixed. to determine which basket has which fruits just by picking up one fruit from only one basket  from which should you pick up the fruit  explain  4  what is your primary programming  5  which one do you prefer  cpp or java  5  other basic resume based questions   answer question
2014-02-12 00:49:06.05,i applied for the internship program through my university recruiting process. the first interview took place on campus. it was about an hour long and pretty straightforward. after about a month i got an email asking me to fly to redmond for a day of onsite interviews. i gladly flew to redmond. treatment and process was really good. everything went smoothly and they even gave money to spend on food and exploring seattle. as for the actual interviews there were 4 back to back interviews. the first 3 were more based on coding on a white board and typical behavioral questions. the 4th one was a design based interview. overall the interviews weren t too hard  but sadly i didn t prepare enough for them.,implement dijkstra s algorithm. i knew the algorithm but messed up on coding it.   answer question
2015-03-26 23:21:48.187,interview process is very smooth. starting from on campus interviews to on site interview. the logistics provided by microsoft are awesome  stay  food  tickets  coupons etc. it was a good experience and learning. the interview is not difficult but one must present accurate answers and should not miss corner cases.,given a linked list change swap each sequential pair of two elements.   answer question queue implementation with fixed array size   answer question given an array  find median element   answer question
2014-09-30 15:31:53.83,it took very long time. attended career fair in sep 2013 and have a on campus interview in mid oct  but no information coming after until feb 2014. the on site interview took about 4 hours  and one of us 10 people can be selected and unfortunately i am not the one. by the way  they provided nice food and the whole process is quite cool. you know  it s microsoft.,typical one  find a b c from 3 arrays.   answer question
2014-02-17 18:19:55.0,applied at campus career fair. contacted one day later. on campus interview. discussed project experience. asked to solve a simple technical problem.,how to eliminate duplicates in a string.   answer question
2013-12-21 15:40:07.907,first went through university recruiting. on campus interview had one tech question  check if you have a valid combination of              . second round  aka final round was on site in seattle. each has a 45 min duration and you have a 15 minutes break in between 4 interviews in this round. first one  given the pointer to a head node that contains 2 pointers pointing to any other 2 nodes like a simplified graph   you need to make a deep copy of this graph. second one  check if a bst is a valid bst third one  given a list of stock prices  you need to find the date when you buy and sell the stock so that your profit is max fourth one  you have a stream  you need to check if the stream contains a specific string in it. the stream can tell you if it is eof. you cannot use any stl  you need to write strlen if you need it  you need to write issubstring if you want to use it.,the first and the last one are fairly complicated. mainly because the first one you need to dfs bfs the graph and then use a hashmap to prevent re creating existing nodes. the second is such a test for your pointer arithmetic and manipulation................   answer question
2014-09-18 17:05:52.573,one on one interview  asked about background  what role i wanted  questioned me if i understood the role  pm . asked about some past projects and then to design a home temperature control system. seemed to want some aspects explained but would not elaborate on exactly what he wanted to hear.,design a home temperature control system.   answer question
2014-11-15 21:04:36.34,i applied last october  had an on campus interview a couple weeks later  then they flew me up to seattle beginning of january. i was surprised how long the interview process took. the first interview was short  30 45 minutes. the final round of interviews took most of the day. there were 3 interviews however the number can range from 2 5 depending on who scheduled them for you   each lasting maybe an hour  maybe more. they told me the following week that i didn t get the job. the questions ranged from difficult to easy. it never felt like a grueling test  it felt more like a conversation about algorithms. unfortunately  on the harder questions  i was the person who didn t know the topic too well.,i cannot say due to confidentiality agreements.   answer question
2015-05-15 21:29:14.81,phone interview  followed by on campus interview. real meat is in the on location interview though. essentially  from 8 5 i met with various current employees of different ranks in the team i was going to work with. questions were either standard conversation fair  probing the depths of your understanding of certain problems  standard algorithm focused coding interviews  and even some pure brainteaser questions.,i mentioned i had done the ai for a video game. i told them i used a  for pathfinding  but when they probed me on it i admitted i used a library implementation  and didn t understand the algorithm in detail. i was then tasked with trying to derive it  knowing that it essentially boils down to dijkstra s shortest path algorithm   a bias.   1 answer
2015-09-08 13:21:53.56,5 rounds of interview in a single day related to algo  ds and design questions. first round was held at university campus and rest were held 1 1 at their california office. it was really great experience as i got chance to talk to really smart people.,related to strings  tree and graph. can  039 t disclose exact questions due to company policy.   answer question
Date, Experience, Questions
2015-09-26 14:26:18.76,phone interview initially. the interview started off with behavioral questions and then progressed to analytical ones. i was then flown out for a full day of interviews. this included three interviews. i was interviewing with a group of other potential interviewees. they had us all in the same building. we were aware of what teams we were interviewing for as well.,q  something along the lines of  amp  034 design a vending machine amp  034  and then  amp  034 design a vending machine that will be used for organic products. amp  034    answer question
2014-01-07 16:24:10.983,met through an on campus recruiter. they emailed me a couple weeks later and set up a phone interview. interview consisted of questions about prior projects  technical questions  logic questions and some general questions about myself.,pretty general questions  nothing too surprising most of the logic questions i had seen before.   answer question
2013-12-17 00:44:13.027,after i submitted my resume online  i got a campus interview after two days. i was invited to a room and talked about my projects and why microsoft. then the interviewer asked me a question that how to delete the number that has shown up before in an array without sorting. i designed an algorithm with double loop which is not good enough for this question. hashtable is better for this  so i didn t get any response after this campus interview.,how to delete the number that has shown up before in an array without sorting.   1 answer
2013-12-13 12:47:10.477,campus career fair asking what s your biggest passion as a software engineer  answered game design. 2nd round campus interview note says would ask coding and require coding during interview. so i prepare heavily on coding and met a hr who s not a sde at all. ask some normal behavioral questions.,what s your biggest passion as a software engineer    answer question
2013-12-18 01:43:22.713,microsoft came to the job fair at my university  where i was able to talk to one of the engineer  and submitted my resume. the university recruiter responsible for my university sent me an email a few days later  inviting me to the on campus interview. the 1st round of on campus interview was not difficult. i was asked to merge 2 sorted linked lists. since i finished it quickly  i get to ask a lot of questions. around 2 weeks after the 1st interview  i got an email from the university recruiter that i passed the 1st round. another recruiter from redmond would get in touch with me. after another 2 weeks  i got an email inviting me to interview on site. it was difficult to schedule the interview at a time that suits me    there were several recruiters  several schedulers  you know  big corporation. but they do try to accommodate my requests and we finally managed to find a date that makes everyone happy. the interview day started very early. we were asked to wait in our hotel lobby at 6 45 am. the van left at 7 00 am. the recruiter met us in the lobby of the building at 7 30. she gave a presentation about microsoft  the interview schedule  etc. and we started to interview with the engineers at 8 00. there were 4 rounds of interviews  45 minutes each  with 15 minutes break in between. afterwards  the whole group went to have lunch together. when we came back  the recruiter talked to us one by one  informing us about the results right away.,typical interview questions that everyone is familiar with.   answer question
2013-12-17 14:51:04.47,i applied online after a recruiter contacted me via linked in. about a week later  they set up a phone interview. it was from hr person. the questions were quite simple.,nothing difficult or unexpected.   answer question
2013-12-10 19:03:23.16,scheduled online and it lasted about 30 minutes. questions all about microsoft products  etc. at the end  the hr lady asked me to solve a sorting algorithm  not in any specific language.,how would you like to design a washing machine  which is your favorite microsoft product    answer question
2013-12-16 15:03:50.793,coding questions are not difficult at all.,the most difficult question is a brain teaser.   answer question
2013-12-10 11:12:01.407,i applied online on my college job portal and got a mail from the recruiter 3 weeks later asking me to schedule a 30 mins on campus interview. the interviewer was very friendly and asked a lot of questions from my resume and prev work experiences. after that she asked me to design an employee feedback application that would record the employee s goals  achievements and the manager would review it. i was asked to come up with design pattern for this problem and think of all possible test cases. it was a very open ended question so i wasn t sure i covered all. nevertheless got a call after 15 days asking me to come onsite. i had 4 1 1 technical rounds on site. all the interviewers were very friendly. they gave us a tour of the campus and took us to the store. they really treat the candidates well and gave us pretty awesome coupons to be used at the store. the interviews were a mixture of coding  design  behavioural  puzzles and resume questions. a lot of distributed network questions were asked. it is good to have an all rounded preparation. don t just concentrate on data structures and oops. some of the questions were   how would you design the swimming pool for a resort in mexico    what data structure would you use for a website like ancestry.com and how and why.  had to write code for this  you have a website that displays the stock prices of every company everyday with trends. how would you test the accuracy of data displayed in the website    you have billions of strings sorted in an array. you don t have any access to it. you just have a method that returns the string pertaining to a index. use only that method to find the location of a given string  i started out at 0 n 2  and kept on improving to o logn  after that  they gave me the results very next day. that was pretty nice of them., you have billions of strings sorted in an array. you don t have any access to it. you just have a method that returns the string pertaining to a index. use only that method to find the location of a given string  i started out at 0 n 2  and kept on improving to o logn    2 answers
2013-11-29 12:30:56.333,screening  1 phone interview  1 in person interview main  3 4 interviews depending on your performance the process is fast  the best part is they tell you the result on the same day,find median of 1 million entries   answer question
Date, Experience, Questions
2013-11-30 01:12:16.323,two rounds of interviews on campus at my school  followed by on site interviews. on site interviews were in a large group of students  with two interviews back to back followed by lunch. everyone received decisions after lunch. overall things were pretty smooth. i heard back quickly after each round of interviews  and microsoft paid for all expenses while traveling there for the on site round. definitely one of the smoother experiences i ve had. the only downside is they don t have access to any feedback when giving your result  which means they can t even tell you how long until you can reapply  because it depends on how close you were to hire no hire   so you ll have to email your recruiter separately and hope for a response.,almost entirely data structures and algorithms questions. nothing overly atypical. surprisingly  didn t even get the  why do you want to work at microsoft   question that i ve heard is really common. almost every interviewer asked a generic  what s a difficult problem you ve worked on     answer question
2013-12-16 20:30:14.733,one none technical phone interview from a recruiter. four rounds of interviews for onsite. three people are grouped together interviewing with the same 4 interviewers. the questions are easy. my friend told me they ask easy questions to make you feel good for interviews if they don t want you. but one interviewer told me that they try to ask questions with same difficulty to make comparisons. they don t provided feedback to you anyway.,i think all the questions are not hard.   answer question
2013-11-28 01:31:51.873,campus recuiting. the interview started with questions about my interests and researches.,interview question looks easy but it could imply many things in it  when i think again after interview    distinguish prime number.   answer question
2013-12-28 04:06:33.29,the overall logistic arrangement was very smooth. i was informed about all steps  such as hotel booking  interview location  reimbursement  etc.  well in advance. i had one telephonic interview and then on site interviews. right after the interviews  i was told that i did not succeed and i can apply again at least after 6 months.,the nature of technical interviewers was pure technical  though i had research background.   answer question
2013-11-16 23:11:57.633,i applied at career fair and scheduled an on campus interview. asked questions about my interests and talked about the company and culture. then there was one coding question. overall  i was disappointed with the process because i felt that the interviewer did not positively portray the company or the position.,write an algorithm to find minimum   of coins for a given amount of change.   answer question
2013-11-15 08:53:41.303,i was selected for on campus interview. the interview was 30 mins  mostly behavioral and one technical ques  very simple  on dns servers.   waiting for the next round  ,reverse a binary tree.   1 answer
2013-11-09 02:05:25.92,recruiter came on campus and i was able to go on campus directly for an interview. i expressed interest in an ui role and they matched me with the least ui relevant team possible  which pretty much made me lose interest in my interviews. i didn t find out until interview day. interviews vary depending on your performance and what the team needs  so they tell you 3 5. i got away with 4.5. the team asked a lot of data structures questions  which was fine  i struggled an appropriate amount and answered most of them. they seemed to be fine with my answers. then my last interview was with the hiring manager  who basically told me no on the spot. he pretty much made circles with his words to avoid telling me no  which was kind of stupid. he told me that my experience was not enough for them and that i should go make some apps or do topcoder. i was fine with not getting the job  but was not fine with the fact that i wasted my entire day interviewing for a team i had zero interest. i also felt that they should not have accepted the interview in the first place if they saw i didn t have relevant experience.,how would you test a keyboard    1 answer
2013-12-04 09:17:04.003,i applied online and got reply after one month. i was asked to arrange a phone interview or skype interview. i chose skype because it would be more comfortable for me. skype or phone interview are exactly the same since the interviewer would not request for a video chat through skype. there were three questions for me and nothing were technical which was really a surprise. the questions were as follows  1. how would you test a keyboard  2. how would you design an alarm clock for blind people  3. there are three baskets with apples  oranges and mix of apples and oranges. each basket has a tag with apple  orange or mix. now we know that all the three tags are wrong. you have only one opportunity to pick one fruit from one basket. how you will choose to identify these three baskets  later  he asked me about my interest and my project experience according to me interest. the interviewer is very kind and professional.,basic 2 sum problem. finding pair of numbers that add to current sum.   2 answers
2013-12-05 21:40:28.893,on campus,the technical question was to write a program that could reverse individual subsections of a list that were separated by punctuation or whitespace. consider the efficiency of your code.   answer question
2013-11-26 18:08:58.017,submitted my resume at a campus event. received an e mail to schedule an interview  which i did. they responded about a week later regarding preparation session and interview details. the interview itself was basically two parts   1  a description of a difficult problem or experience and  2  a relatively straightforward programming question.,No Question
Date, Experience, Questions
2013-11-18 22:21:26.473,the communication started through career fair. when i gave my resume to one of their representative  current engineer at microsoft   he quickly asked few questions to get to know about my background. later he told me that he would forward this to one of the recruiter and he will contact me if there is a suitable match. i had to raise my eyebrow here  cause the guy has my resume and he asked me several questions. this alone should be enough to proceed ahead with interview or no interview. reading other posts  it seems ms conducts onsite campus interviews  then why forward to recruiter. perhaps  due to lower reputation of my university  they do not want to spend too much time interviewing people onsite. a couple of weeks later  i got an email to schedule a phone interview. at last  something is better than nothing as i get about half an hour to prove my capacity. i have gone through interview posts here on glassdoor and i could not find any details on phone interviews. most were either college interviews or people talking about their onsite interviews after passing phone interview. in any case  i prepared myself with the questions posted and later on i realized those were overkill for the phone interview. now  i have gone through plenty of phone interviews with multiple tech giants. in most cases  i have made it to later rounds in phone interview  but no onsite though. well  i just want to say i have become quite comfortable with these initial interviews  both technically and behaviorally. the interviewer called on time and we started with discussing my background. this was already done when i submitted my resume  so i see no point in reiterating all this. although  i was asked similar questions in my past interviews  but on those occasions  i did not forward my resume personally and the initial phone calls were the first time when i spoke to someone inside the company. next i was asked several semi technical and behavioral questions. most of these questions are already discussed elsewhere  therefore i will not emphasize much on those. however  i will mention some of them below  cause i think it s on these questions i may have under performed. as for other questions  i am sure  design a table    test an elevator  and  determining apple  orange and apple orange from incorrectly labelled boxes  should ring a bell or you will certainly encounter them if you search on internet. few days later  i got the usual no offer email. the only positive thing i can take is they told me to reapply in 6 months. from what i know  they usually give a 1 year clause  therefore this was a good rejection  i hope. i did give some ridiculous answers which could be a good reason for rejection. i will discuss them in question sections below. perhaps you guys could judge if this is certainly worth getting a rejection.,how many lines of code have you written in your favorite project    3 answers what is your favorite microsoft product  what feature would you add to it    1 answer
2014-01-28 18:10:07.37,there was one technical interview. the questions asked were basic. there was one programming question   to check if a given word was legal based on a list of alphabets provided.,what is recursion used for    answer question
2013-10-24 16:08:27.2,i only went through one interview in college. i applied through the career fair held in my school. and i am waiting for their response of whether to give me an on site interview. the interview took half an hour and asked about my research and project at the beginning. then i was asked to write some part of programs for the reversi game.,programming for the reversi game  for some rules    answer question
2013-10-17 23:10:36.763,microsoft showed up at our campus  career fair. i dropped my resume by their booth and a few weeks later was notified via email that i was invited to an interview on my college s campus. the interview was 30 minutes long and consisted of about 15 minutes of behavioral questions and the other 15 minutes was for the one technical question listed below. the behavior questions included things such as  why did you choose computer science  ,implement an algorithm to return a copy of a linked list in which each node has random pointers to other nodes within the list.   1 answer
2013-11-19 13:14:33.463,everything about microsoft s interview process is great  start   apply on website   on campus   through recruiter first   phone screen   on campus interview  easy  second   fly out to seattle for full day interviews  medium  end   you usually get a few weeks to reply to the offer  i got a month they usually don t tell you what team you ll be interviewing for  but it doesn t matter. they don t ask you anything specific about the team anyway. almost everything in the seattle trip is covered including room service  rental car  meals  etc. they really treat their candidates well. the interviews take a few hours  4 rounds of 45 50minute interviews on a whiteboard at their office  and range from medium to hard difficulty. they don t tell you too much about the company offer process from the get go but are very friendly and respond to any questions you have quickly. i would highly recommend going through this process especially if you have a negative impression of microsoft. the  evil  rumors just simply aren t true   and the company is great. their compensation package is top notch and would easily match google facebook etc. the disposable income you get is probably more than you d get anywhere else given that washington has 0  state income tax  and the living expenses in seattle are reasonable.,write a function that takes an integer array and removes duplicates from it  easy  follow up  now optimize it  trying to minimize cpi  hard   note  you need knowledge of branch prediction  loop unrolling and other computer architecture concepts for this part    answer question
2013-10-13 19:12:24.917,on campus interview. 30 minutes. half behavioral questions. two simple technical questions. but didn t solve it fast enough.,what s the most technical challenges you have ever had    answer question
